{
  "format": "physical-studio-steps",
  "version": 1,
  "title": "Arduino Uno case",
  "model": "design.glb",
  "units": "mm",
  "bounds": {
    "min": [
      -11.2,
      -5.0,
      -7.0
    ],
    "max": [
      73.6,
      58.4,
      16.5
    ]
  },
  "placements": [
    {
      "id": "base",
      "kind": "enclosure",
      "part": null,
      "name": "Case base",
      "position": [
        0.0,
        0.0,
        0.0
      ],
      "rotation": [
        0.0,
        0.0,
        0.0
      ],
      "color": "#d9d9d9"
    },
    {
      "id": "uno",
      "kind": "part",
      "part": "arduino-uno",
      "name": "Arduino Uno Rev3",
      "position": [
        0.0,
        0.0,
        0.0
      ],
      "rotation": [
        0.0,
        0.0,
        0.0
      ],
      "color": "#1f6fb2",
      "pins": [
        {
          "id": "nc",
          "position": [
            27.94,
            2.54,
            10.1
          ]
        },
        {
          "id": "ioref",
          "position": [
            30.48,
            2.54,
            10.1
          ]
        },
        {
          "id": "reset",
          "position": [
            33.02,
            2.54,
            10.1
          ]
        },
        {
          "id": "3v3",
          "position": [
            35.56,
            2.54,
            10.1
          ]
        },
        {
          "id": "5v",
          "position": [
            38.1,
            2.54,
            10.1
          ]
        },
        {
          "id": "gnd1",
          "position": [
            40.64,
            2.54,
            10.1
          ]
        },
        {
          "id": "gnd2",
          "position": [
            43.18,
            2.54,
            10.1
          ]
        },
        {
          "id": "vin",
          "position": [
            45.72,
            2.54,
            10.1
          ]
        },
        {
          "id": "a0",
          "position": [
            50.8,
            2.54,
            10.1
          ]
        },
        {
          "id": "a1",
          "position": [
            53.34,
            2.54,
            10.1
          ]
        },
        {
          "id": "a2",
          "position": [
            55.88,
            2.54,
            10.1
          ]
        },
        {
          "id": "a3",
          "position": [
            58.42,
            2.54,
            10.1
          ]
        },
        {
          "id": "a4",
          "position": [
            60.96,
            2.54,
            10.1
          ]
        },
        {
          "id": "a5",
          "position": [
            63.5,
            2.54,
            10.1
          ]
        },
        {
          "id": "d0",
          "position": [
            63.5,
            50.8,
            10.1
          ]
        },
        {
          "id": "d1",
          "position": [
            60.96,
            50.8,
            10.1
          ]
        },
        {
          "id": "d2",
          "position": [
            58.42,
            50.8,
            10.1
          ]
        },
        {
          "id": "d3",
          "position": [
            55.88,
            50.8,
            10.1
          ]
        },
        {
          "id": "d4",
          "position": [
            53.34,
            50.8,
            10.1
          ]
        },
        {
          "id": "d5",
          "position": [
            50.8,
            50.8,
            10.1
          ]
        },
        {
          "id": "d6",
          "position": [
            48.26,
            50.8,
            10.1
          ]
        },
        {
          "id": "d7",
          "position": [
            45.72,
            50.8,
            10.1
          ]
        },
        {
          "id": "d8",
          "position": [
            41.66,
            50.8,
            10.1
          ]
        },
        {
          "id": "d9",
          "position": [
            39.12,
            50.8,
            10.1
          ]
        },
        {
          "id": "d10",
          "position": [
            36.58,
            50.8,
            10.1
          ]
        },
        {
          "id": "d11",
          "position": [
            34.04,
            50.8,
            10.1
          ]
        },
        {
          "id": "d12",
          "position": [
            31.5,
            50.8,
            10.1
          ]
        },
        {
          "id": "d13",
          "position": [
            28.96,
            50.8,
            10.1
          ]
        },
        {
          "id": "gnd3",
          "position": [
            26.42,
            50.8,
            10.1
          ]
        },
        {
          "id": "aref",
          "position": [
            23.88,
            50.8,
            10.1
          ]
        },
        {
          "id": "sda",
          "position": [
            21.34,
            50.8,
            10.1
          ]
        },
        {
          "id": "scl",
          "position": [
            18.8,
            50.8,
            10.1
          ]
        }
      ]
    },
    {
      "id": "lid",
      "kind": "enclosure",
      "part": null,
      "name": "Case lid",
      "position": [
        0.0,
        0.0,
        0.0
      ],
      "rotation": [
        0.0,
        0.0,
        0.0
      ],
      "color": "#f2f2f2"
    }
  ],
  "steps": [
    {
      "index": 1,
      "title": "Lay out the case base",
      "text": "Put the printed base on the bench with the two port openings on the left.",
      "add": [
        "base"
      ],
      "check": "Base is upright with the USB and barrel-jack openings on the left wall."
    },
    {
      "index": 2,
      "title": "Drop in the Arduino",
      "text": "Lower the Uno onto the four standoffs, USB port first into the left opening.",
      "add": [
        "uno"
      ],
      "motion": [
        {
          "placement": "uno",
          "from_offset": [
            0,
            0,
            40
          ]
        }
      ],
      "callouts": [
        {
          "text": "USB-B goes into this opening",
          "target": "uno",
          "at": [
            -3,
            38.1,
            7
          ]
        },
        {
          "text": "Barrel jack",
          "target": "uno",
          "at": [
            -1,
            7.6,
            7
          ]
        }
      ],
      "dimensions": [
        {
          "from": [
            13.97,
            2.54,
            1.6
          ],
          "to": [
            15.24,
            50.8,
            1.6
          ],
          "label": "48.3 mm hole spacing"
        }
      ],
      "check": "All four mounting holes sit on standoffs and the USB-B port lines up with the left opening."
    },
    {
      "index": 3,
      "title": "Close the lid",
      "text": "Press the lid on until the lip seats inside the walls.",
      "add": [
        "lid"
      ],
      "motion": [
        {
          "placement": "lid",
          "from_offset": [
            0,
            0,
            50
          ]
        }
      ],
      "tools": [
        {
          "name": "Hands only",
          "for": "press fit"
        }
      ],
      "check": "Lid sits flush all the way round."
    }
  ],
  "prompt": "A case for an Arduino Uno with the USB port reachable on the side.",
  "print": {
    "size_mm": [
      84.8,
      63.4,
      23.5
    ],
    "material": "PLA",
    "pieces": [
      {
        "id": "base",
        "name": "Case base",
        "file": "design-base.stl",
        "volume_mm3": 21918,
        "grams": 27.2,
        "minutes": 136
      },
      {
        "id": "lid",
        "name": "Case lid",
        "file": "design-lid.stl",
        "volume_mm3": 11410,
        "grams": 14.1,
        "minutes": 71
      }
    ],
    "total_grams": 41.3,
    "total_minutes": 207,
    "step_file": null
  }
}
